{
  "schema_version": "1.0.0",
  "source_id": "SRC-INVASIONAUTOPRODUCTS-993-K16-INTERNAL-DATA",
  "title": "Invasion Auto Products - K16-2467GGA8.88GAAXK de 993 Turbo, donnees internes",
  "url": "https://www.invasionautoproducts.com/",
  "publisher": "Invasion Auto Products",
  "source_type": "marketplace",
  "content_types": ["technical_data", "parts_catalogue"],
  "coverage": {
    "generation": "993",
    "variants": ["Turbo"],
    "parts": ["turbocharger", "compressor_wheel", "turbine_wheel", "wastegate"]
  },
  "access": {
    "status": "available",
    "method": "browser_page_read",
    "accessed_on": "2026-09-27"
  },
  "rights": {
    "license": "vendor-site-copyright-reference-only",
    "redistribution": "prohibited",
    "attribution": "Invasion Auto Products"
  },
  "quality": {
    "evidence_level": "C",
    "dimensional_accuracy": "declared",
    "verified_against": ["SRC-TURBOMASTER-993-K16-6735-PARTS"]
  },
  "notes": "Seule source publique trouvee donnant les diametres de roues (turbine 5316-120-5000: induit 54,96 / exduct 48,97 mm, 12 pales; compresseur 5324-123-2006: induit 40,6 / exduct 60,5 mm, 6+6), les angles de volute (alpha 307,5 degres / beta 70 degres) et le calibrage wastegate (ressort 0,50 bar, leve 4,20 mm). A/R et CHRA recoupes par TurboMaster; diametres de roues et calibrage en source unique. Declaration fournisseur, jamais une mesure; aucune carte compresseur."
}
