{
  "schema_version": "1.0.0",
  "source_id": "SRC-RENN3DPARTS-993-OPEN-FILES",
  "title": "Renn 3D Parts - Archive communautaire de fichiers STL 993",
  "url": "https://renn3dparts.com/vehicles/911/993",
  "publisher": "Renn 3D Parts / contributeurs communautaires",
  "source_type": "dataset",
  "content_types": ["mesh", "technical_data", "photograph"],
  "coverage": {
    "generation": "993",
    "variants": ["Coupe", "Cabrio", "Targa", "a_confirmer_par_fiche"],
    "parts": [
      "split_grille_bar",
      "gauge_ring_phone_mount",
      "hifi_4x6_speaker_adapter",
      "remote_clutch_bleeder_bracket",
      "seat_back_release_button",
      "pollen_filter_cover_repair_tabs",
      "rear_main_seal_installation_tool",
      "center_console_cup_holder",
      "center_console_switch_tab_repair"
    ]
  },
  "access": {
    "status": "available",
    "method": "browser_page_read",
    "accessed_on": "2026-08-30"
  },
  "rights": {
    "license": "mixed-per-part-license-declared-by-archive",
    "redistribution": "unknown",
    "attribution": "Renn 3D Parts and original contributor named on each part record"
  },
  "quality": {
    "evidence_level": "D",
    "dimensional_accuracy": "declared",
    "verified_against": []
  },
  "notes": "La page d'archive consultee le 2026-08-30 recense neuf fiches 993 avec fichiers STL, photos de montage, bboxes et liens vers les sources originales Thingiverse ou Printables. Les fiches detaillees declarent les licences par enregistrement : Custom Split-Grille Bar CC-BY-NC-SA (trois STL, 355,934 x 140 x 18,805 mm), Gauge-Ring Phone Mount CC-BY (un STL, anneau autour d'un compteur de 82 mm, bbox 136,013 x 91,999 x 35,520 mm), HiFi 4x6 Speaker Adapter Frames Public Domain (deux STL, bbox 2152,040 x 1437,940 x 253,976 mm), Remote Clutch Bleeder Bracket CC-BY-NC (deux STL, bbox 50,000 x 49,081 x 28,442 mm), Seat Back Release Control Button CC-BY (un STL, bbox 40,130 x 37,500 x 26,000 mm), Pollen-Filter Cover Repair Tabs CC-BY (quatre STL, bbox 30,700 x 18 x 10,800 mm), Rear Main Seal Installation Tool Set CC-BY-SA (quatre STL, bbox 225,299 x 208,077 x 45,000 mm), Center-Console Twin Cup Holder Public Domain (un STL, bbox 224,803 x 92,300 x 69,051 mm) et Center Console Switch-Tab Repair Kit CC-BY (un STL, bbox 67,000 x 63,678 x 5,500 mm). L'archive indique la licence au niveau de chaque fiche, jamais comme licence globale; le lien et les conditions de la source primaire doivent donc etre verifies avant toute redistribution ou inclusion dans le depot. Les bboxes sont des declarations de fichier, sans rapport de mesure ni controle independant; la bbox HiFi tres grande doit notamment etre verifiee pour une erreur d'unites. Ne pas copier les meshes dans le depot sans conserver l'auteur, la source primaire, la licence exacte et une comparaison sur piece. Les outils lies a l'embrayage et au joint spi, ainsi que le bouton de siege, ne sont pas des pieces de remplacement a liberer par la seule presence d'un fichier. 2026-10-15: none of the nine original Thingiverse or Printables pages could be read (the Thingiverse robots.txt is served behind a Cloudflare bot challenge, and Printables model pages answer HTTP 403 with a JavaScript challenge). The nine part records (SRC-RENN3D-*) therefore record each licence as 'archive-reported-...-primary-page-not-verified' with redistribution unknown, and this archive-level record stays unknown. The HiFi speaker frame envelope remains unresolved and excluded from use. See docs/research/public-3d-asset-licence-audit-2026-10-15.md."
}
