{
  "schema_version": "1.0.0",
  "source_id": "SRC-ASTM-F3302-18",
  "title": "ASTM F3302-18 Standard for Additive Manufacturing - Finished Part Properties - Standard Specification for Titanium Alloys via Powder Bed Fusion",
  "url": "https://store.astm.org/f3302-18.html",
  "publisher": "ASTM International",
  "source_type": "official",
  "content_types": [
    "material_data",
    "technical_data"
  ],
  "coverage": {
    "generation": "generic_automotive",
    "variants": [
      "titanium_alloy_PBF_finished_part"
    ],
    "parts": [
      "exhaust_tip"
    ]
  },
  "access": {
    "status": "paywalled",
    "method": "browser_page_read",
    "accessed_on": "2026-10-15"
  },
  "rights": {
    "license": "standards-copyright-reference-only",
    "redistribution": "prohibited",
    "attribution": "ASTM International"
  },
  "quality": {
    "evidence_level": "A",
    "dimensional_accuracy": "unknown",
    "verified_against": []
  },
  "notes": "Public ASTM store product page read on 2026-10-15. Listed as active, 2018 edition, page last updated 2018-02-21; no later revision is listed on the page or found in a web search the same day. Committee F42, subcommittee F42.05. Scope as stated on the public page: titanium alloy components made by full-melt powder bed fusion for applications needing properties similar to wrought products; parts may need post-processing such as machining or polishing to meet surface and dimensional requirements. Purchase required. Finished-part counterpart of F2924 for the delivered part; which of the two governs a given order is for the purchase contract and the supplier to state. No table is reproduced; the ASTM page states that use of AI on ASTM standards is prohibited, so only designation, title and scope are cited."
}
