{
  "schema_version": "1.0.0",
  "source_id": "SRC-PORSCHE-DE-993-TURBO-S-HERITAGE",
  "title": "Porsche 911 (Typ 993) Turbo S",
  "url": "https://newsroom.porsche.com/de/pressemappen/Porsche-Heritage-Experience/Porsche-911-%28Typ-993%29-Turbo-S.html",
  "publisher": "Porsche AG / Porsche Museum",
  "source_type": "official",
  "content_types": [
    "technical_data"
  ],
  "coverage": {
    "generation": "generic_automotive",
    "variants": [],
    "parts": [
      "engine"
    ]
  },
  "access": {
    "status": "available",
    "method": "browser_page_read",
    "accessed_on": "2026-10-03"
  },
  "rights": {
    "license": "publisher-copyright-reference-only",
    "redistribution": "prohibited",
    "attribution": "Porsche AG / Porsche Museum"
  },
  "quality": {
    "evidence_level": "B",
    "dimensional_accuracy": "unknown",
    "verified_against": []
  },
  "notes": "Official German heritage page and downloadable bilingual factory datasheet. MY1998 450 PS example only; neither inspected item specifies torque or an overboost function. Reviewed language: de. Edition/publication metadata: not stated. Acquisition: HTTP 200. Captured HTTP-response SHA-256: 5428b0d196f6b5cc8222c9cbf9825af41747a22a239c412b9f12cbe0e01734a0. Only original factual paraphrases and metadata are redistributed; the raw document remains outside the repository."
}
