{
  "schema_version": "1.0.0",
  "source_id": "SRC-MEZGER-DE-MATERIALS-RR-PRODUCT",
  "title": "Alufont: Alufont-60 alloy application and mechanical properties",
  "url": "https://rheinfelden-alloys.eu/legierungen/alufont/",
  "publisher": "RHEINFELDEN ALLOYS",
  "source_type": "manufacturer",
  "content_types": [
    "technical_data"
  ],
  "coverage": {
    "generation": "generic_automotive",
    "variants": [],
    "parts": [
      "engine"
    ]
  },
  "access": {
    "status": "available",
    "method": "browser_page_read",
    "accessed_on": "2026-10-03"
  },
  "rights": {
    "license": "publisher-copyright-reference-only",
    "redistribution": "prohibited",
    "attribution": "RHEINFELDEN ALLOYS"
  },
  "quality": {
    "evidence_level": "B",
    "dimensional_accuracy": "unknown",
    "verified_against": []
  },
  "notes": " Reviewed language: de. Edition/publication metadata: Undated German product page; reviewed 2026-10-03. Acquisition: HTTP 200. Captured HTTP-response SHA-256: c35f62de236fb4294097dede9622f55370a1fe5de56ce07653ee4d760bf14488. Only original factual paraphrases and metadata are redistributed; the raw document remains outside the repository."
}
