{
  "schema_version": "1.0.0",
  "source_id": "SRC-3D-OLDTIMER-GERMANY-RE",
  "title": "3D-Oldtimer - Reconstruction et impression de pieces de classiques en Allemagne",
  "url": "https://3d-oldtimer.de/",
  "publisher": "3D-Oldtimer",
  "source_type": "manufacturer",
  "content_types": ["scan", "cad", "measurement", "technical_data", "material_data"],
  "coverage": {
    "generation": "generic_automotive",
    "variants": ["classic_cars", "Porsche_911", "Porsche_924"],
    "parts": ["clips", "holders", "interior_parts", "fuel_line_holder"]
  },
  "access": {
    "status": "available",
    "method": "browser_page_read",
    "accessed_on": "2026-08-29"
  },
  "rights": {
    "license": "commercial-manufacturer-site-copyright",
    "redistribution": "prohibited",
    "attribution": "3D-Oldtimer"
  },
  "quality": {
    "evidence_level": "B",
    "dimensional_accuracy": "declared",
    "verified_against": []
  },
  "notes": "Le fabricant allemand annonce un flux scan-CAD-impression, un controle d'ajustement dans l'assemblage, et un test de cycles de montage/demontage. Il montre notamment un support de conduite de carburant pour Porsche 924/911, pas un cas 993, et revendique 22 articles. Les affirmations de pratique et de test restent celles du fabricant; aucun fichier CAO public ni protocole de mesure detaille n'est fourni. Le support de conduite de carburant est une zone sensible : cette fiche est une piste de contact et non une autorisation de fabriquer ou de liberer une piece du circuit carburant."
}
