{
  "schema_version": "1.0.0",
  "source_id": "SRC-BMB-GERMANY-CT-RE",
  "title": "BMB - CT industrielle allemande et reconstruction de surface",
  "url": "https://www.bmb-ndt.de/pruefverfahren/computertomographie-ct",
  "publisher": "BMB Gesellschaft für Materialprüfung mbH",
  "source_type": "manufacturer",
  "content_types": ["scan", "measurement", "cad", "technical_data"],
  "coverage": {
    "generation": "generic_automotive",
    "variants": ["Germany", "industrial_CT"],
    "parts": ["plastic_components", "metal_components", "assemblies", "internal_geometries"]
  },
  "access": {
    "status": "available",
    "method": "browser_page_read",
    "accessed_on": "2026-08-30"
  },
  "rights": {
    "license": "commercial-service-site-terms",
    "redistribution": "prohibited",
    "attribution": "BMB Gesellschaft für Materialprüfung mbH"
  },
  "quality": {
    "evidence_level": "B",
    "dimensional_accuracy": "declared",
    "verified_against": []
  },
  "notes": "Le laboratoire allemand BMB publie trois configurations CT : microfocus 225 kV avec une detailerkennbarkeit d'environ 7 µm pour 500 × 300 mm et 7 kg; microfocus 300 kV avec environ 6 µm pour 3 500 × 2 000 mm et 200 kg; minifocus 450 kV avec environ 0,2 mm pour 3 500 × 2 000 mm et 200 kg. La page annonce la mesure de cotes internes et externes, la reconstruction de surfaces et la production de STL pour le reverse engineering, avec rapports et visualisation. Aucun cas 993, jeu de données, incertitude par zone, STEP ou licence de reutilisation n'est public; demander un devis pour une pièce déposée et faire préciser les datums, l'incertitude, le format et les droits."
}
