{
  "schema_version": "1.0.0",
  "source_id": "SRC-PORSCHEFANATICS-993-ENGINE-AIR-COOLING-PET",
  "title": "Porsche Fanatics - releve PET 993 du refroidissement par air moteur",
  "url": "https://porschefanatics.com/oem/993/105-00/",
  "publisher": "Porsche Fanatics",
  "source_type": "dataset",
  "content_types": ["parts_catalogue", "technical_data"],
  "coverage": {
    "generation": "993",
    "variants": ["catalogue_993_non_resolu_par_configuration"],
    "parts": [
      "cooling_fan_and_impellers",
      "fan_housing",
      "belt_and_pulleys",
      "rotating_hubs_and_spacers",
      "sender",
      "mounting_and_adjustment_parts"
    ]
  },
  "access": {
    "status": "available",
    "method": "browser_page_read",
    "accessed_on": "2026-09-02"
  },
  "rights": {
    "license": "site-owner-confirmed-reference-only",
    "redistribution": "unknown",
    "attribution": "Porsche Fanatics ; Porsche AG pour le PET source"
  },
  "quality": {
    "evidence_level": "C",
    "dimensional_accuracy": "unknown",
    "verified_against": ["SRC-PET-993-KAT17-PDF"]
  },
  "notes": "La page 105-00 et les donnees locales PorscheFanatics identifient 86 occurrences documentaires et 50 references OEM uniques autour de la ventilation moteur, de son entrainement par courroie, des poulies, du carter et des elements de reglage ou de retenue. Trente-six references apparaissent dans les deux transcriptions PET chargees. Le releve ne prouve ni la topologie d'entrainement, ni les diametres, les vitesses, le debit d'air, les temperatures, les matieres, les interfaces ou l'equilibrage. Il sert a construire une topologie candidate a verifier, jamais une geometrie de fabrication ou une validation vehicule."
}
