{
  "schema_version": "1.0.0",
  "source_id": "SRC-TECHART-993-REAR-SPOILER-MOUNTING-MANUAL",
  "title": "TECHART - Notice allemande de montage du spoiler arrière III pour Porsche 993",
  "url": "https://www.techart.de/fileadmin/content/PDF/manuals/archive/093.100.820.099_993_Montageanleitung_Heckspoiler_III.pdf",
  "publisher": "TECHART Automobildesign GmbH",
  "source_type": "manufacturer",
  "content_types": ["manual", "technical_data", "drawing"],
  "coverage": {
    "generation": "993",
    "variants": ["Carrera", "Turbo"],
    "parts": ["rear_spoiler", "rear_lid", "spoiler_hinges", "brake_light_wiring"]
  },
  "access": {
    "status": "available",
    "method": "browser_page_read",
    "accessed_on": "2026-08-30"
  },
  "rights": {
    "license": "manufacturer-manual-copyright",
    "redistribution": "prohibited",
    "attribution": "TECHART Automobildesign GmbH"
  },
  "quality": {
    "evidence_level": "A",
    "dimensional_accuracy": "unknown",
    "verified_against": []
  },
  "notes": "La notice allemande de six pages identifie les références TECHART 093.100.820.009 à 093.100.822.009 et distingue le montage sur 993 Carrera et 993 Turbo. Elle indique notamment qu'un kit de montage 093.100.850.009 est requis pour le Carrera, ainsi que les points de fixation, les pièces à déposer et les différences de raccordement du feu stop. Les figures sont des schémas de montage sans coordonnées cotées; il ne s'agit pas d'un plan de carrosserie OEM. Zone soumise à des efforts aérodynamiques : aucune reproduction ou modification libérable sans contrôle de variante, validation du montage et revue appropriée."
}
