{
  "schema_version": "1.0.0",
  "source_id": "SRC-PFF-993-BODY-DIMENSIONS",
  "title": "PFF - Dimensions exterieures des variantes de caisse 993",
  "url": "https://www.pff.de/thread/2812238-an-die-wirklichen-kenner-turbobreite-karossen-nur-fuer-die-s-modelle/",
  "publisher": "PFF - Porsche Forum",
  "source_type": "community",
  "content_types": ["measurement", "technical_data"],
  "coverage": {
    "generation": "993",
    "variants": ["Carrera", "Carrera_S", "Carrera_4S", "Turbo", "Carrera_RS", "GT2"],
    "parts": ["full_body_exterior"]
  },
  "access": {
    "status": "available",
    "method": "browser_page_read",
    "accessed_on": "2026-08-29"
  },
  "rights": {
    "license": "forum-content-rights-not-verified",
    "redistribution": "unknown",
    "attribution": "PFF; participants du sujet"
  },
  "quality": {
    "evidence_level": "C",
    "dimensional_accuracy": "declared",
    "verified_against": []
  },
  "notes": "Le fil allemand rapporte 4245 x 1735 x 1300 mm pour Carrera, 4245 x 1795 x 1285 mm pour Turbo/S/4S, 4245 x 1735 x 1310 mm pour Carrera RS et 4245 x 1855 x 1310 mm pour GT2. Les valeurs sont des declarations de membres, sans definition complete des points de mesure ni repetition; la largeur hors-retroviseurs reste discutee dans un autre fil PFF. Reference d'encombrement et de tri de variantes uniquement, pas surface nominale de fabrication."
}
