{
  "schema_version": "1.0.0",
  "source_id": "SRC-SPANESI-WINTOUCH-VEHICLE-DATA",
  "title": "Spanesi - Touch measuring system and WinTouch vehicle database",
  "url": "https://www.spanesi.com/automotive-measuring-systems/touch/",
  "publisher": "Spanesi S.p.A.",
  "source_type": "manufacturer",
  "content_types": [
    "technical_data"
  ],
  "coverage": {
    "generation": "generic_automotive",
    "variants": [
      "Porsche_993_coverage_not_publicly_confirmed"
    ],
    "parts": [
      "body_measuring_datasheets"
    ]
  },
  "access": {
    "status": "available",
    "method": "browser_page_read",
    "accessed_on": "2026-10-15"
  },
  "rights": {
    "license": "all-rights-reserved-reference-only",
    "redistribution": "prohibited",
    "attribution": "Spanesi S.p.A."
  },
  "quality": {
    "evidence_level": "unrated",
    "dimensional_accuracy": "unknown",
    "verified_against": []
  },
  "notes": "Read on 2026-10-15 for issue #10; robots.txt sets a 30-second crawl delay and no disallow rule. Two page fetches on this site on 2026-10-15 did not respect that 30-second crawl delay. The page describes the WinTouch database of vehicle data, says new vehicles are added and updates are released regularly, and gives no vehicle count, no public vehicle list or search and no access terms. Porsche is not mentioned; a Porsche 993 sheet is therefore not publicly confirmed, which does not show it is absent."
}
