{
  "schema_version": "1.0.0",
  "source_id": "SRC-M64-WORLD-A-NAPREC-P061",
  "title": "NAPREC Porsche 930/964 reinforced valve spring kit",
  "url": "https://www.naprec.co.jp/product/p061",
  "publisher": "NAPREC Co., Ltd.",
  "source_type": "manufacturer",
  "content_types": [
    "technical_data"
  ],
  "coverage": {
    "generation": "generic_automotive",
    "variants": [],
    "parts": [
      "engine"
    ]
  },
  "access": {
    "status": "available",
    "method": "direct_download",
    "accessed_on": "2026-10-25"
  },
  "rights": {
    "license": "publisher-copyright-reference-only",
    "redistribution": "prohibited",
    "attribution": "NAPREC Co., Ltd."
  },
  "quality": {
    "evidence_level": "B",
    "dimensional_accuracy": "declared",
    "verified_against": []
  },
  "notes": "Primary kit maker. Title only establishes 930/964 family; no exact engine suffix or 993 Turbo fit. Dedicated lower seats and chromoly retainers are part of this kit. No wire diameter, installed height, alloy grade or fatigue qualification published. Reviewed on 2026-10-25. Edition: Undated current product page; retrieved 2026-10-25. Reviewed representation: Direct HTTPS response HTML bytes. Representation SHA-256: 38643cccdac965be10945f07ba63634a04f82fd4a1d368377e2d9538fb58aa74. Original source-document bytes acquired: yes. Raw captures are not redistributed."
}
